{"$schema":"https://json-schema.org/draft/2020-12/schema","$id":"https://soul-kaleidoscope.local/schemas/context-rule.schema.json","title":"Soul Kaleidoscope Phase 6 Context Rule Dataset","type":"object","additionalProperties":false,"required":["version","phase","datasetId","reviewStatus","capturedAt","records","annualPositionMatrix","blockedScopes","governance"],"properties":{"version":{"type":"string","pattern":"^\\d+\\.\\d+\\.\\d+$"},"phase":{"const":"Phase 6"},"datasetId":{"const":"context-rules"},"reviewStatus":{"enum":["Pending","Candidate","Reviewed","Rejected","Conflict","Canonical"]},"capturedAt":{"type":"string","format":"date-time"},"records":{"type":"array","minItems":1,"uniqueItems":false,"items":{"$ref":"#/$defs/contextRule"}},"annualPositionMatrix":{"type":"object","additionalProperties":false,"required":["reviewStatus","annualValues","positionValues","matchKeyFormat","recordCount","interpretations","autoGenerateInterpretations"],"properties":{"reviewStatus":{"enum":["Pending","Candidate","Reviewed","Rejected","Conflict","Canonical"]},"annualValues":{"type":"array","const":[1,2,3,4,5,6,7,8,9]},"positionValues":{"type":"array","const":[1,2,3,4,5,6,7,8,9]},"matchKeyFormat":{"const":"annual:<annual>|position:<position>"},"recordCount":{"const":81},"interpretations":{"type":["null","array"]},"autoGenerateInterpretations":{"const":false}}},"blockedScopes":{"type":"array","minItems":1,"items":{"type":"object","additionalProperties":false,"required":["id","scope","reason"],"properties":{"id":{"type":"string","pattern":"^P6-BLOCK-\\d{3}$"},"scope":{"type":"string","minLength":1},"reason":{"type":"string","minLength":1}}}},"governance":{"type":"object","additionalProperties":false,"required":["manualApprovalRequired","autoPublish","publishedTarget","approvalRecord"],"properties":{"manualApprovalRequired":{"const":true},"autoPublish":{"const":false},"publishedTarget":{"type":"null"},"approvalRecord":{"type":"null"}}}},"$defs":{"sourceRef":{"type":"object","additionalProperties":false,"required":["sourceId","sourceType","location","section"],"properties":{"sourceId":{"type":"string","minLength":1},"sourceType":{"type":"string","minLength":1},"location":{"type":"string","minLength":1},"section":{"type":"string","minLength":1}}},"contextRule":{"type":"object","additionalProperties":false,"required":["id","domain","contextType","title","matchKey","reviewStatus","version","lastReviewedAt","dependsOn","rule","sourceRefs","governance"],"properties":{"id":{"type":"string","pattern":"^CTX-\\d{3}$"},"domain":{"const":"context-rule"},"contextType":{"enum":["number-chain","calendar-role","position-role","annual-cycle","birthday-switch","weighting","innate-frequency","conditional-combination","soul-level-link"]},"title":{"type":"string","minLength":1},"matchKey":{"type":"object","additionalProperties":false,"required":["type","key"],"properties":{"type":{"type":"string","minLength":1},"key":{"type":"string","minLength":1}}},"reviewStatus":{"enum":["Pending","Candidate","Reviewed","Rejected","Conflict","Canonical"]},"version":{"type":"string","pattern":"^\\d+\\.\\d+\\.\\d+$"},"lastReviewedAt":{"type":["null","string"]},"dependsOn":{"type":"array","minItems":1,"items":{"type":"string","minLength":1}},"rule":{"type":"object","additionalProperties":false,"required":["summary","inputs","outputs","constraints","interpretationBoundary"],"properties":{"summary":{"type":"string","minLength":1},"inputs":{"type":"array","minItems":1,"items":{"type":"string","minLength":1}},"outputs":{"type":"array","minItems":1,"items":{"type":"string","minLength":1}},"constraints":{"type":"array","minItems":1,"items":{"type":"string","minLength":1}},"interpretationBoundary":{"type":"string","minLength":1}}},"sourceRefs":{"type":"array","minItems":1,"items":{"$ref":"#/$defs/sourceRef"}},"governance":{"type":"object","additionalProperties":false,"required":["approvedBy","approvalRecord","notes"],"properties":{"approvedBy":{"type":"null"},"approvalRecord":{"type":"null"},"notes":{"type":"string","minLength":1}}}}}}}
