{"version":"0.1.0","phase":"Phase 6","datasetId":"context-rules","reviewStatus":"Candidate","capturedAt":"2026-07-13T00:00:00.000Z","records":[{"id":"CTX-001","domain":"context-rule","contextType":"number-chain","title":"完整鏈式與最後主數雙層保存","matchKey":{"type":"number-chain","key":"compound-and-final"},"reviewStatus":"Candidate","version":"0.1.0","lastReviewedAt":null,"dependsOn":["phase4:continuous-reduction","number-topic:0-9"],"rule":{"summary":"所有可縮減數值同時保存完整鏈式與最後主數；兩者用途不同，不互相覆蓋。","inputs":["rawTotal","reductionChain"],"outputs":["fullChain","finalNumber"],"constraints":["fullChain 必須保留每一步縮減","finalNumber 必須等於鏈式最後一段","顯示層不得只保存 finalNumber"],"interpretationBoundary":"完整鏈式用於呈現形成過程；最後主數只引用已核准的 0～9 基本本體。"},"sourceRefs":[{"sourceId":"ROADMAP-P6","sourceType":"project-document","location":"NEXT_PHASE_ROADMAP.md","section":"Phase 6"},{"sourceId":"PHASE4-FORMAL","sourceType":"project-decision","location":"DEC-20260711-003.md","section":"Phase 4-S"},{"sourceId":"ENGINE-2.2.1","sourceType":"github","location":"calculator-deploy/public/core.js","section":"calculation functions"}],"governance":{"approvedBy":null,"approvalRecord":null,"notes":"Phase 6 conservative candidate; no runtime publication."}},{"id":"CTX-002","domain":"context-rule","contextType":"number-chain","title":"複合數與基本數字分層引用","matchKey":{"type":"number-chain","key":"compound-context-reference"},"reviewStatus":"Candidate","version":"0.1.0","lastReviewedAt":null,"dependsOn":["context-rule:CTX-001","number-topic:0-9"],"rule":{"summary":"複合數可以保留來源與形成脈絡，但不得自行建立另一套 0～9 定義。","inputs":["fullChain","finalNumber","contextRole"],"outputs":["compoundContextRef","baseNumberRef"],"constraints":["複合數層不得複製基本數字全文","未核准的複合數意義保持空白或 Pending"],"interpretationBoundary":"複合數只描述形成脈絡；基本性質由 finalNumber 對應的正式 NUM 條目提供。"},"sourceRefs":[{"sourceId":"ROADMAP-P6","sourceType":"project-document","location":"NEXT_PHASE_ROADMAP.md","section":"Phase 6"},{"sourceId":"PHASE5-FORMAL","sourceType":"project-decision","location":"DEC-20260711-004.md","section":"Phase 5-S"}],"governance":{"approvedBy":null,"approvalRecord":null,"notes":"Phase 6 conservative candidate; no runtime publication."}},{"id":"CTX-003","domain":"context-rule","contextType":"calendar-role","title":"國曆與農曆結果分開保存","matchKey":{"type":"calendar-role","key":"solar-lunar-separation"},"reviewStatus":"Candidate","version":"0.1.0","lastReviewedAt":null,"dependsOn":["phase4:solar-calculation","phase4:lunar-calculation"],"rule":{"summary":"國曆與農曆是兩組可並列的計算結果，資料層必須保留各自來源、鏈式、角色與生日切換狀態。","inputs":["solarResult","lunarResult"],"outputs":["solarContext","lunarContext"],"constraints":["不得把國曆與農曆數值相加成未定義的新數字","不得用其中一套覆蓋另一套","農曆需保留閏月與計算月資訊"],"interpretationBoundary":"解讀可以比較兩組結果，但不得把比較文字反寫為計算規則。"},"sourceRefs":[{"sourceId":"ROADMAP-P6","sourceType":"project-document","location":"NEXT_PHASE_ROADMAP.md","section":"Phase 6"},{"sourceId":"PHASE4-FORMAL","sourceType":"project-decision","location":"DEC-20260711-003.md","section":"Phase 4-S"},{"sourceId":"ENGINE-2.2.1","sourceType":"github","location":"calculator-deploy/public/core.js","section":"calculation functions"}],"governance":{"approvedBy":null,"approvalRecord":null,"notes":"Phase 6 conservative candidate; no runtime publication."}},{"id":"CTX-004","domain":"context-rule","contextType":"position-role","title":"日月綻放是位置角色","matchKey":{"type":"position-role","key":"day-moon"},"reviewStatus":"Candidate","version":"0.1.0","lastReviewedAt":null,"dependsOn":["phase4:day-moon-chain","number-topic:0-9"],"rule":{"summary":"日月綻放保存月與日形成的完整鏈式及最後主數，作為特定位置角色，不等同主命數。","inputs":["calendarType","birthMonth","birthDay","dayMoonChain"],"outputs":["dayMoonContext","baseNumberRef"],"constraints":["國曆與農曆分開保存","只引用對應最後主數的基本本體","位置解讀不得改寫數字本體"],"interpretationBoundary":"日月綻放描述頻率如何向外展開；人格與生命核心仍由其他已定義位置共同判讀。"},"sourceRefs":[{"sourceId":"ROADMAP-P6","sourceType":"project-document","location":"NEXT_PHASE_ROADMAP.md","section":"Phase 6"},{"sourceId":"PHASE4-FORMAL","sourceType":"project-decision","location":"DEC-20260711-003.md","section":"Phase 4-S"},{"sourceId":"ENGINE-2.2.1","sourceType":"github","location":"calculator-deploy/public/core.js","section":"calculation functions"}],"governance":{"approvedBy":null,"approvalRecord":null,"notes":"Phase 6 conservative candidate; no runtime publication."}},{"id":"CTX-005","domain":"context-rule","contextType":"position-role","title":"四組木馬依期間分工","matchKey":{"type":"position-role","key":"horse-1-4"},"reviewStatus":"Candidate","version":"0.1.0","lastReviewedAt":null,"dependsOn":["phase4:horse-formula","number-topic:0-9"],"rule":{"summary":"木馬一至四使用固定公式與固定期間角色；數值為 0 時仍保留，不自行改成 9。","inputs":["horseFirst","horseSecond","horseThird","horseFourth"],"outputs":["before40","transition36to40","lifelong","after41"],"constraints":["木馬一代表 40 歲前","木馬二代表 36～40 歲","木馬三代表終其一生","木馬四代表 41 歲後","位置角色不得與數字本體混寫"],"interpretationBoundary":"木馬描述潛意識自動模式在不同期間的運作位置；數字意義仍引用正式基本本體。"},"sourceRefs":[{"sourceId":"ROADMAP-P6","sourceType":"project-document","location":"NEXT_PHASE_ROADMAP.md","section":"Phase 6"},{"sourceId":"PHASE4-FORMAL","sourceType":"project-decision","location":"DEC-20260711-003.md","section":"Phase 4-S"},{"sourceId":"ENGINE-2.2.1","sourceType":"github","location":"calculator-deploy/public/core.js","section":"calculation functions"},{"sourceId":"USER-RULE-HORSE-20260602","sourceType":"user-confirmed-rule","location":"project memory","section":"horse period rules"}],"governance":{"approvedBy":null,"approvalRecord":null,"notes":"Phase 6 conservative candidate; no runtime publication."}},{"id":"CTX-006","domain":"context-rule","contextType":"position-role","title":"國曆與農曆貴人分開保存","matchKey":{"type":"position-role","key":"solar-lunar-noble"},"reviewStatus":"Candidate","version":"0.1.0","lastReviewedAt":null,"dependsOn":["phase4:noble-formula","number-topic:0-9"],"rule":{"summary":"國曆貴人與農曆貴人使用相同類型公式但不同日期來源，必須保存為兩個獨立欄位。","inputs":["solarNoble","lunarNoble"],"outputs":["solarNobleContext","lunarNobleContext"],"constraints":["不得合併成單一貴人數","不得以相同結果推定兩者角色相同","只引用基本數字條目"],"interpretationBoundary":"貴人位置描述支持、協作與外部連結的線索，不作保證性預測。"},"sourceRefs":[{"sourceId":"ROADMAP-P6","sourceType":"project-document","location":"NEXT_PHASE_ROADMAP.md","section":"Phase 6"},{"sourceId":"PHASE4-FORMAL","sourceType":"project-decision","location":"DEC-20260711-003.md","section":"Phase 4-S"},{"sourceId":"ENGINE-2.2.1","sourceType":"github","location":"calculator-deploy/public/core.js","section":"calculation functions"}],"governance":{"approvedBy":null,"approvalRecord":null,"notes":"Phase 6 conservative candidate; no runtime publication."}},{"id":"CTX-007","domain":"context-rule","contextType":"annual-cycle","title":"流年描述年度行動主題","matchKey":{"type":"annual-cycle","key":"annual-flow"},"reviewStatus":"Candidate","version":"0.1.0","lastReviewedAt":null,"dependsOn":["phase4:annual-flow","number-topic:0-9"],"rule":{"summary":"流年保留完整鏈式與最後主數，用於描述當年度較明顯的行動主題與發展方向。","inputs":["calendarType","adoptedYear","annualChain","annualFinal"],"outputs":["annualThemeRef"],"constraints":["國曆與農曆分開保存","流年不得當成人格定義","生日切換前後使用對應 adoptedYear"],"interpretationBoundary":"流年提供年度主題，不預言必然事件，也不覆蓋固定主頻率。"},"sourceRefs":[{"sourceId":"ROADMAP-P6","sourceType":"project-document","location":"NEXT_PHASE_ROADMAP.md","section":"Phase 6"},{"sourceId":"PHASE4-FORMAL","sourceType":"project-decision","location":"DEC-20260711-003.md","section":"Phase 4-S"},{"sourceId":"ENGINE-2.2.1","sourceType":"github","location":"calculator-deploy/public/core.js","section":"calculation functions"}],"governance":{"approvedBy":null,"approvalRecord":null,"notes":"Phase 6 conservative candidate; no runtime publication."}},{"id":"CTX-008","domain":"context-rule","contextType":"annual-cycle","title":"今年位格描述運作位置","matchKey":{"type":"annual-cycle","key":"annual-position"},"reviewStatus":"Candidate","version":"0.1.0","lastReviewedAt":null,"dependsOn":["phase4:position-number","position:1-9"],"rule":{"summary":"今年位格使用 1～9 最後主數，描述年度環境位置、資源配置與運作方式。","inputs":["calendarType","ageStep","positionNumber"],"outputs":["positionRef"],"constraints":["位格與流年分開","位格不得當成人格定義","國曆與農曆分開保存","正式顯示只使用最後主數"],"interpretationBoundary":"位格說明當年度站位與運作條件；基本數字與固定主頻率不可被位格內容取代。"},"sourceRefs":[{"sourceId":"ROADMAP-P6","sourceType":"project-document","location":"NEXT_PHASE_ROADMAP.md","section":"Phase 6"},{"sourceId":"PHASE4-FORMAL","sourceType":"project-decision","location":"DEC-20260711-003.md","section":"Phase 4-S"},{"sourceId":"ENGINE-2.2.1","sourceType":"github","location":"calculator-deploy/public/core.js","section":"calculation functions"},{"sourceId":"POSITION-1.0.0","sourceType":"github","location":"calculator-deploy/data/sngl/positions.v1.json","section":"positions 1-9"}],"governance":{"approvedBy":null,"approvalRecord":null,"notes":"Phase 6 conservative candidate; no runtime publication."}},{"id":"CTX-009","domain":"context-rule","contextType":"birthday-switch","title":"生日切換由查詢日期決定","matchKey":{"type":"birthday-switch","key":"before-after-birthday"},"reviewStatus":"Candidate","version":"0.1.0","lastReviewedAt":null,"dependsOn":["phase4:annual-flow","phase4:lunar-date-resolution"],"rule":{"summary":"年度流年與位格必須依查詢日期判斷生日是否已過；國曆與農曆各自判斷。","inputs":["queryDate","solarBirthdayInQueryYear","lunarBirthdayInQueryLunarYear"],"outputs":["solarBirthdayStatus","lunarBirthdayStatus","adoptedYear"],"constraints":["尚未過生日採前一年度","已過生日採查詢年度","農曆生日使用查詢日期所屬農曆年換算","無法唯一換算時標記 needsReview"],"interpretationBoundary":"生日前／生日後是年度狀態切換，不改變固定主命、木馬與貴人資料。"},"sourceRefs":[{"sourceId":"ROADMAP-P6","sourceType":"project-document","location":"NEXT_PHASE_ROADMAP.md","section":"Phase 6"},{"sourceId":"PHASE4-FORMAL","sourceType":"project-decision","location":"DEC-20260711-003.md","section":"Phase 4-S"},{"sourceId":"ENGINE-2.2.1","sourceType":"github","location":"calculator-deploy/public/core.js","section":"calculation functions"}],"governance":{"approvedBy":null,"approvalRecord":null,"notes":"Phase 6 conservative candidate; no runtime publication."}},{"id":"CTX-010","domain":"context-rule","contextType":"annual-cycle","title":"流年與位格 81 組只建立結構鍵","matchKey":{"type":"annual-